{
  "date": "2026-10-16",
  "generatedAt": "2026-10-16T10:10:57Z",
  "editorNote": "Meta released Muse Spark as an open-weight multimodal model, and the follow-on coverage is the day’s main thread: Hugging Face, PyTorch, Nvidia and AWS all posted support, with Apple working on Mac performance. Nvidia also published its Nemotron 3.5 Super VL for agents. On the policy side, the FTC is reportedly probing Anthropic and OpenAI, and Anthropic is giving METR deeper access for evaluations.",
  "lead": {
    "id": "9d251ac6836a600d8fed2294d5c3f8928f6177ed",
    "url": "https://huggingface.co/blog/meta-muse-spark-open",
    "canonicalUrl": "https://huggingface.co/blog/meta-muse-spark-open",
    "title": "Welcome Muse Spark Open: open-weight frontier multimodal mixture-of-experts model from Meta",
    "source": "Hugging Face Blog",
    "sourceTier": 1,
    "categoryHint": "Tools & Releases",
    "author": null,
    "publishedAt": "2026-10-15T00:00:00Z",
    "fetchedAt": "2026-10-16T10:09:06Z",
    "signals": {
      "hnPoints": null,
      "hnComments": null,
      "redditScore": null,
      "githubStars": null,
      "githubStarsDelta": null,
      "crossSourceCount": 5
    },
    "scores": {
      "importance": 8,
      "trend": 7,
      "novelty": 8,
      "credibility": 9
    },
    "total": 7.9,
    "category": "Tools & Releases",
    "tags": [
      "open-weights",
      "muse-spark",
      "multimodal",
      "moe"
    ],
    "summary": "Hugging Face documents the open-weight release of Meta's Muse Spark, a multimodal mixture-of-experts model, with usage notes for developers.",
    "whyItMatters": "Open frontier-class weights change build-or-buy math for teams hosting their own models.",
    "featuredSlot": "lead",
    "previouslyFeatured": false
  },
  "top": [
    {
      "id": "b382a6d08a5fad47657b74a0396d7466baa1a1c5",
      "url": "https://developer.nvidia.com/blog/nvidia-nemotron-3-5-super-vl-powers-specialized-agents-with-multimodal-reasoning/",
      "canonicalUrl": "https://developer.nvidia.com/blog/nvidia-nemotron-3-5-super-vl-powers-specialized-agents-with-multimodal-reasoning",
      "title": "NVIDIA Nemotron 3.5 Super VL Powers Specialized Agents with Multimodal Reasoning",
      "source": "NVIDIA Technical Blog",
      "sourceTier": 1,
      "categoryHint": "Tools & Releases",
      "author": "Michelle Horton",
      "publishedAt": "2026-10-15T18:01:00Z",
      "fetchedAt": "2026-10-16T10:09:06Z",
      "signals": {
        "hnPoints": null,
        "hnComments": null,
        "redditScore": null,
        "githubStars": null,
        "githubStarsDelta": null,
        "crossSourceCount": 2
      },
      "scores": {
        "importance": 6,
        "trend": 2,
        "novelty": 6,
        "credibility": 8
      },
      "total": 5.3,
      "category": "Tools & Releases",
      "tags": [
        "nemotron",
        "nvidia",
        "multimodal",
        "agents",
        "open-weights"
      ],
      "summary": "Nvidia's technical blog presents Nemotron 3.5 Super VL, a vision-language model aimed at specialized agents.",
      "whyItMatters": "Another open multimodal option for agent builders on Nvidia hardware.",
      "featuredSlot": "top",
      "previouslyFeatured": false
    },
    {
      "id": "12f70f9144a8a1f106ce0facd34c0f8991c14e35",
      "url": "https://arstechnica.com/tech-policy/2026/10/ftc-probes-if-openai-anthropic-security-incidents-harmed-americans-report-says/",
      "canonicalUrl": "https://arstechnica.com/tech-policy/2026/10/ftc-probes-if-openai-anthropic-security-incidents-harmed-americans-report-says",
      "title": "Report: FTC probes Anthropic, OpenAI after Trump dismissed AI fears as “hoax”",
      "source": "Ars Technica: AI",
      "sourceTier": 2,
      "categoryHint": "News",
      "author": "Ashley Belanger",
      "publishedAt": "2026-10-15T15:43:24Z",
      "fetchedAt": "2026-10-16T10:09:06Z",
      "signals": {
        "hnPoints": null,
        "hnComments": null,
        "redditScore": null,
        "githubStars": null,
        "githubStarsDelta": null,
        "crossSourceCount": 1
      },
      "scores": {
        "importance": 6,
        "trend": 1,
        "novelty": 6,
        "credibility": 6
      },
      "total": 4.8,
      "category": "Policy & Safety",
      "tags": [
        "regulation",
        "ftc",
        "openai",
        "anthropic"
      ],
      "summary": "Ars Technica reports the FTC is probing Anthropic and OpenAI, based on a report.",
      "whyItMatters": "Regulatory attention could affect both major API vendors.",
      "featuredSlot": "top",
      "previouslyFeatured": false
    },
    {
      "id": "e925c3137a8af8ad4b86cdc573df0a8e88ba79b3",
      "url": "https://techcrunch.com/2026/10/15/anthropic-is-letting-metr-researchers-look-under-the-hood-with-employee-level-access/",
      "canonicalUrl": "https://techcrunch.com/2026/10/15/anthropic-is-letting-metr-researchers-look-under-the-hood-with-employee-level-access",
      "title": "Anthropic is letting METR researchers look under the hood with employee-level access",
      "source": "TechCrunch: AI",
      "sourceTier": 2,
      "categoryHint": "Business",
      "author": "Aditya Mehta",
      "publishedAt": "2026-10-15T19:14:26Z",
      "fetchedAt": "2026-10-16T10:09:06Z",
      "signals": {
        "hnPoints": null,
        "hnComments": null,
        "redditScore": null,
        "githubStars": null,
        "githubStarsDelta": null,
        "crossSourceCount": 1
      },
      "scores": {
        "importance": 6,
        "trend": 1,
        "novelty": 6,
        "credibility": 6
      },
      "total": 4.8,
      "category": "Policy & Safety",
      "tags": [
        "anthropic",
        "metr",
        "evaluation",
        "safety"
      ],
      "summary": "TechCrunch reports Anthropic is giving METR researchers employee-level access to its systems.",
      "whyItMatters": "Deeper third-party access could improve credibility of safety evaluations.",
      "featuredSlot": "top",
      "previouslyFeatured": false
    },
    {
      "id": "3733c75a28bf26df988281155bac3e5cdfdea7ba",
      "url": "https://huggingface.co/blog/flux-3",
      "canonicalUrl": "https://huggingface.co/blog/flux-3",
      "title": "Welcome FLUX.3 Image Klein in Diffusers",
      "source": "Hugging Face Blog",
      "sourceTier": 1,
      "categoryHint": "Tools & Releases",
      "author": null,
      "publishedAt": "2026-10-15T00:00:00Z",
      "fetchedAt": "2026-10-16T10:09:06Z",
      "signals": {
        "hnPoints": null,
        "hnComments": null,
        "redditScore": null,
        "githubStars": null,
        "githubStarsDelta": null,
        "crossSourceCount": 1
      },
      "scores": {
        "importance": 5,
        "trend": 0,
        "novelty": 6,
        "credibility": 8
      },
      "total": 4.5,
      "category": "Tools & Releases",
      "tags": [
        "flux",
        "diffusers",
        "image-generation"
      ],
      "summary": "Hugging Face post on running FLUX.3 Image Klein in the Diffusers library.",
      "whyItMatters": "Ready-to-use path for the new FLUX variant.",
      "featuredSlot": "top",
      "previouslyFeatured": false
    },
    {
      "id": "13e122947fcaa3ffca2c34949d01bb10907334f3",
      "url": "https://aws.amazon.com/blogs/machine-learning/metas-muse-spark-open-now-available-in-amazon-sagemaker-jumpstart/",
      "canonicalUrl": "https://aws.amazon.com/blogs/machine-learning/metas-muse-spark-open-now-available-in-amazon-sagemaker-jumpstart",
      "title": "Meta’s Muse Spark Open now available in Amazon SageMaker JumpStart",
      "source": "AWS Machine Learning Blog",
      "sourceTier": 1,
      "categoryHint": "Tools & Releases",
      "author": "Aris Tsakpinis",
      "publishedAt": "2026-10-15T17:43:35Z",
      "fetchedAt": "2026-10-16T10:09:06Z",
      "signals": {
        "hnPoints": null,
        "hnComments": null,
        "redditScore": null,
        "githubStars": null,
        "githubStarsDelta": null,
        "crossSourceCount": 1
      },
      "scores": {
        "importance": 5,
        "trend": 1,
        "novelty": 5,
        "credibility": 8
      },
      "total": 4.5,
      "category": "Tools & Releases",
      "tags": [
        "muse-spark",
        "aws",
        "sagemaker"
      ],
      "summary": "AWS announces Muse Spark Open availability in SageMaker JumpStart.",
      "whyItMatters": "Managed deployment path for the new open-weight model.",
      "featuredSlot": "top",
      "previouslyFeatured": false
    }
  ],
  "innovations": [],
  "trending": [
    {
      "id": "c-0ef47f92a6",
      "label": "Meta Muse Spark goes open-weight",
      "itemIds": [
        "9d251ac6836a600d8fed2294d5c3f8928f6177ed",
        "7b4e8f58fbe641dbc50b63278f4c8f8373ab8e9d",
        "d5bac5a69bce90a0a930f42b78047fcdacbf44c1",
        "a4975bebfd36893f3dfb4aa4b7361688b57edab7",
        "7b45a5eb01c2a2c86d634fc5e2a2daaf94feca02"
      ],
      "leadItemId": "9d251ac6836a600d8fed2294d5c3f8928f6177ed",
      "sources": [
        "Hugging Face Blog",
        "PyTorch Blog",
        "TechCrunch: AI",
        "The Verge: AI",
        "WIRED: AI"
      ],
      "trendDelta": 4.86
    },
    {
      "id": "c-6a197c9576",
      "label": "Google Universal Cart shopping launch",
      "itemIds": [
        "244831af62488291746c094805c773184e49f261",
        "a6d305e8949d43bb502519dde260e145335ee20c"
      ],
      "leadItemId": "a6d305e8949d43bb502519dde260e145335ee20c",
      "sources": [
        "TechCrunch: AI",
        "ZDNET: AI"
      ],
      "trendDelta": 2
    },
    {
      "id": "c-7d8227baa4",
      "label": "Nvidia Nemotron 3.5 Super VL",
      "itemIds": [
        "b382a6d08a5fad47657b74a0396d7466baa1a1c5",
        "3acf1ce3b7a126f869992ff17c294a23d481be7f"
      ],
      "leadItemId": "b382a6d08a5fad47657b74a0396d7466baa1a1c5",
      "sources": [
        "NVIDIA Technical Blog",
        "ZDNET: AI"
      ],
      "trendDelta": 2
    }
  ],